ID_da_instituicao	nome_da_instituicao	ID_da_microregiao	ID_da_mesoregiao	ID_do_estado	Publicacoes_Disciplina_Biologia	Publicacoes_Disciplina_Biotecnologia	Publicacoes_Disciplina_Especialidades_Medicas	Publicacoes_Disciplina_Engenharias_Civil_Mecanica_e_Quimica	Publicacoes_Disciplina_Quimica	Publicacoes_Disciplina_Ciencias_da_Natureza	Publicacoes_Disciplina_Engenharia_Eletrica_e_Ciencias_da_Computacao	Publicacoes_Disciplina_Pesquisas_Neurologicas	Publicacoes_Disciplina_Humanas	Publicacoes_Disciplina_Doencas_Infecciosas	Publicacoes_Disciplina_Matematica_e_Fisica	Publicacoes_Disciplina_Profissionais_da_Saude	Publicacoes_Disciplina_Ciencias_Sociais	Total_Publicacoes
281100000001	UNIVERSIDADE CEUMA	21002	2101	21	1	2	5	2	2	0	0	3	0	6	1	5	0	27
802600000009	UNIVERSIDADE CAMILO CASTELO BRANCO	35061	3515	35	2	1	2	1	5	0	1	0	0	5	1	7	0	25
000700000003	INSTITUTO DE PESQUISAS TECNOLOGICAS DO ESTADO DE SAO PAULO	35061	3515	35	1	2	0	6	3	0	0	0	0	0	1	0	1	14
208000000009	FUNDACAO FACULDADE DE MEDICINA	35061	3515	35	2	0	11	0	0	0	0	0	0	2	0	3	0	18
869900000005	INSTITUTO MILITAR DE ENGENHARIA	33018	3306	33	0	1	2	9	6	1	5	0	0	0	6	4	0	34
301700000000	CENTRO UNIVERSITARIO HERMINIO OMETTO DE ARARAS	35027	3506	35	0	1	2	0	1	0	0	0	0	1	1	10	0	16
985600169126	ASSOCIACAO HOSPITALAR MOINHOS DE VENTO	43026	4305	43	1	1	7	0	0	0	0	1	0	4	0	4	0	18
246100000003	UNIVERSIDADE DO PORTO	22001	2201	22	6	0	10	2	10	0	1	3	0	4	5	5	1	47
154300000001	UNIVERSIDADE DE MOGI DAS CRUZES	35062	3515	35	1	1	8	1	4	1	0	1	0	3	0	3	1	24
428800000000	UNIVERSIDADE ESTADUAL DO PIAUI	22012	2203	22	5	0	2	4	8	0	1	1	0	5	1	3	0	30
422900000003	CENTRO UNIVERSITARIO DA FUNDACAO EDUCACIONAL DE BARRETOS	35009	3502	35	1	0	1	2	0	0	0	0	0	2	0	4	0	10
J1JP00000008	FACULDADE DE ENGENHARIA DA UNIVERSIDADE DO PORTO	22001	2201	22	0	0	1	9	0	0	2	0	0	1	2	2	0	17
