ID_da_instituicao	nome_da_instituicao	ID_da_microregiao	ID_da_mesoregiao	ID_do_estado	Publicacoes_Disciplina_Biologia	Publicacoes_Disciplina_Biotecnologia	Publicacoes_Disciplina_Especialidades_Medicas	Publicacoes_Disciplina_Engenharias_Civil_Mecanica_e_Quimica	Publicacoes_Disciplina_Quimica	Publicacoes_Disciplina_Ciencias_da_Natureza	Publicacoes_Disciplina_Engenharia_Eletrica_e_Ciencias_da_Computacao	Publicacoes_Disciplina_Pesquisas_Neurologicas	Publicacoes_Disciplina_Humanas	Publicacoes_Disciplina_Doencas_Infecciosas	Publicacoes_Disciplina_Matematica_e_Fisica	Publicacoes_Disciplina_Profissionais_da_Saude	Publicacoes_Disciplina_Ciencias_Sociais	Total_Publicacoes
281100000001	UNIVERSIDADE CEUMA	21002	2101	21	4	2	4	1	3	0	0	5	0	7	1	9	0	36
802600000009	UNIVERSIDADE CAMILO CASTELO BRANCO	35061	3515	35	1	0	2	1	2	0	0	0	0	3	0	7	1	17
000700000003	INSTITUTO DE PESQUISAS TECNOLOGICAS DO ESTADO DE SAO PAULO	35061	3515	35	2	3	6	7	3	0	1	2	0	6	3	2	1	36
208000000009	FUNDACAO FACULDADE DE MEDICINA	35061	3515	35	2	0	8	0	1	0	0	3	0	3	0	1	0	18
869900000005	INSTITUTO MILITAR DE ENGENHARIA	33018	3306	33	2	3	1	12	4	0	6	0	0	2	2	3	1	36
301700000000	CENTRO UNIVERSITARIO HERMINIO OMETTO DE ARARAS	35027	3506	35	2	0	3	0	2	1	0	1	0	1	0	10	0	20
985600169126	ASSOCIACAO HOSPITALAR MOINHOS DE VENTO	43026	4305	43	0	0	7	0	0	0	0	0	0	2	0	1	0	10
246100000003	UNIVERSIDADE DO PORTO	22001	2201	22	6	0	6	6	10	3	0	4	0	2	6	8	1	52
154300000001	UNIVERSIDADE DE MOGI DAS CRUZES	35062	3515	35	2	1	4	1	4	0	1	1	0	3	0	6	0	23
428800000000	UNIVERSIDADE ESTADUAL DO PIAUI	22012	2203	22	7	0	2	2	6	1	1	1	0	4	5	3	1	33
422900000003	CENTRO UNIVERSITARIO DA FUNDACAO EDUCACIONAL DE BARRETOS	35009	3502	35	2	0	1	0	1	0	0	0	0	4	0	3	0	11
J1JP00000008	FACULDADE DE ENGENHARIA DA UNIVERSIDADE DO PORTO	22001	2201	22	0	0	1	4	1	0	4	2	0	0	0	2	1	15
